{
  "schema": "truth.summary.v1",
  "project": "Sample Truth Project",
  "runId": "2026-06-25T13-55-22Z",
  "status": "BLOCKED",
  "sourceHead": "91a12fe",
  "remoteHead": "91a12fe",
  "publicHead": "63c0625",
  "branch": "main",
  "repo": "Letterblack0306/LetterBlack-Sentinel",
  "startedAt": "2026-06-25T13:55:22Z",
  "finishedAt": "2026-06-25T13:56:10Z",
  "modules": [
    {
      "moduleId": "git-state",
      "label": "Git State",
      "type": "probe",
      "parent": "release-transaction",
      "targetAction": "read_git_state",
      "connectedTo": { "right": "build-public-sdk" },
      "status": "PASS",
      "evidence": ["commands.jsonl#cmd_git_head"]
    },
    {
      "moduleId": "build-public-sdk",
      "label": "Build Public SDK",
      "type": "build_step",
      "parent": "release-transaction",
      "targetAction": "build_public_package",
      "connectedTo": { "left": "git-state", "right": "release-public-scan" },
      "status": "PASS",
      "evidence": ["release-public-tree.txt"]
    },
    {
      "moduleId": "release-public-scan",
      "label": "Public Safety Scan",
      "type": "scan",
      "parent": "release-transaction",
      "targetAction": "scan_public_files",
      "connectedTo": { "left": "build-public-sdk", "right": "public-repo-verifier" },
      "status": "PASS",
      "evidence": ["files.jsonl"]
    },
    {
      "moduleId": "public-repo-verifier",
      "label": "Public Repo Verifier",
      "type": "remote_probe",
      "parent": "release-transaction",
      "targetAction": "fresh_clone_public_repo",
      "connectedTo": { "left": "release-public-scan" },
      "status": "FAIL",
      "evidence": ["final-receipt.txt"]
    }
  ],
  "checks": [
    {
      "id": "readme_exists",
      "label": "README exists",
      "status": "PASS",
      "evidence": "release-public/README.md"
    },
    {
      "id": "public_repo_clone_match",
      "label": "Public repo clone matches release-public",
      "status": "FAIL",
      "evidence": "final-receipt.txt"
    },
    {
      "id": "forbidden_terms_scan",
      "label": "Forbidden private terms scan",
      "status": "PASS",
      "evidence": "files.jsonl"
    }
  ]
}
